{
  "unit_id": "mdsu0020",
  "line_start": 2554,
  "line_end": 2701,
  "source_text": "# **Step 17 — 状態遷移の網羅性・到達可能性検査**\n\n実施モード：DESIGN-ONLY\n\n対象は Step 16 の状態機械案です。到達不能状態、不正な遷移、回復条件の欠落、エラー分類の重複、状態軸間の矛盾を検査します。\n\n## **1\\. 状態遷移の網羅性**\n\n| ID | 検査項目 | 暫定判定 | 必要な補正 |\n| ----- | ----- | ----- | ----- |\n| RA-01 | 初期状態からの到達可能性 | 未証明 | 初期状態と全遷移を固定する |\n| RA-02 | 全状態の出辺定義 | 未充足 | 通常遷移・失敗遷移・停止条件を列挙する |\n| RA-03 | 終端状態からの再開 | 未定義 | 新規試行と同一試行の再開を区別する |\n| RA-04 | `HOLD` からの回復 | 部分定義 | 回復条件と再検証条件を明示する |\n| RA-05 | エラー分類の重複 | 要検査 | 複数条件成立時の優先順位を固定する |\n| RA-06 | エラー分類の未定義領域 | 要検査 | 未分類障害を成功扱いしない |\n| RA-07 | 状態軸間の矛盾 | 未充足 | 不正な組合せを禁止する |\n| RA-08 | `GATED` の独立性 | 設計原則あり | 全遷移で権限状態を独立検査する |\n| RA-09 | 反復上限到達後の挙動 | 部分定義 | 同一試行への自動復帰を禁止する |\n| RA-10 | `REVIEW_COMPLETE` の成立条件 | 未確定 | 必須レビュー・検証・記録条件を定義する |\n\nこの判定は設計記述に対するものであり、実装の不具合を確認した結果ではありません。\n\n## **2\\. 状態軸間の不正な組合せ**\n\n複数の状態軸を使う場合、それぞれの値が個別に有効でも、組合せ全体が不正になる可能性があります。\n\n| ID | 不正な組合せの候補 | 必要な制約 |\n| ----- | ----- | ----- |\n| INV-17-01 | `VALIDATION_FAILED` なのに `REVIEW_COMPLETE` | 検証失敗を未解決のまま完了扱いしない |\n| INV-17-02 | 必須証拠が `MISSING` なのに `DESIGN_RESOLVED` | 必須証拠の欠落を解消するか、正式に不要と裁定する |\n| INV-17-03 | 依存グラフが循環状態なのに優先順位確定済み | 順位確定を保留する |\n| INV-17-04 | `REVIEW_COMPLETE` から自動的に `AUTHORIZED` | 明示的な許可手続きを要求する |\n| INV-17-05 | `ITERATION_LIMIT_REACHED` から同一試行へ自動復帰 | 新しい試行 ID と明示的な再開条件を要求する |\n| INV-17-06 | `CONFLICT_UNRESOLVED` なのに全候補が解決済み | 競合記録と候補状態の整合性を要求する |\n| INV-17-07 | `FROZEN` なのに対象バージョンが未特定 | Freeze 対象と証跡の識別を要求する |\n\n`EVIDENCE_STATUS=UNKNOWN` と `MISSING` は同義ではありません。前者は有無や評価が未確定、後者は必要な証拠が存在しない、または要求された証拠が提供されていない状態として区別します。\n\n## **3\\. 回復・再開契約**\n\n次の規則を補正候補として追加します。\n\n| RULE\\_ID | 規範候補 | 必須条件 |\n| ----- | ----- | ----- |\n| RA-R-01 | `HOLD` の解除には、保留理由に対応する新しい証拠または規範判断が必要 | 変更内容と証拠参照を記録 |\n| RA-R-02 | `VALIDATION_FAILED` の再試行には、障害原因の解消または再試行可能との明示的判断が必要 | 新しい試行 ID、実行設定、結果を記録 |\n| RA-R-03 | `ITERATION_LIMIT_REACHED` は同一試行内で解除しない | 新規レビュー ID、上限、再開理由を記録 |\n| RA-R-04 | `CONFLICT_UNRESOLVED` の解除には競合の裁定記録が必要 | 競合対象、採択理由、未解決事項を記録 |\n| RA-R-05 | `REVIEW_COMPLETE` 後の規範変更は、新しいレビュー単位として扱う | 入力バージョンと差分を記録 |\n\nこれらの規則は、過去の結果を消去せず、新しい情報に基づく再評価を可能にします。\n\n## **4\\. エラー分類の排他性**\n\nエラー分類には、少なくとも次の順序が必要です。\n\nA. 実行・検証器の健全性を確認\n\n   |\n\n   \\+-- failure confirmed\n\n   |      \\-\\> VALIDATION\\_FAILED\n\n   |\n\n   v\n\nB. 契約違反を確認\n\n   |\n\n   \\+-- violation confirmed\n\n   |      \\-\\> REJECT\n\n   |\n\n   v\n\nC. 必須情報・証拠の充足性を確認\n\n   |\n\n   \\+-- insufficient\n\n   |      \\-\\> HOLD\n\n   |\n\n   v\n\nD. 機械的検証に適合\n\n          \\-\\> ACCEPT\\_FOR\\_REVIEW\n\nただし、これだけでは、意味的レビューの障害、監査記録の書込み失敗、複数障害の併存を完全には分類できません。そのため、最終仕様では次を区別する必要があります。\n\n* `PRIMARY_FAILURE`：処理を停止させた主たる失敗分類  \n* `SECONDARY_FAILURES`：同時に観測された副次的失敗  \n* `FAILURE_STAGE`：失敗した処理段階  \n* `RETRYABILITY`：再試行可能性とその根拠\n\nこれらの値は観測された事実に基づいて記録し、原因が不明な場合に推測で補完しません。\n\n## **5\\. 到達可能性検査の受入基準**\n\n| TEST\\_ID | 試験条件 | 期待結果 |\n| ----- | ----- | ----- |\n| RA-T-01 | 初期状態から各通常状態への経路を探索 | 到達不能状態を報告 |\n| RA-T-02 | 各状態の遷移先が未定義 | 網羅性検査で検出 |\n| RA-T-03 | `HOLD` から証拠を変えずに再試行 | 自動的に保留を解除しない |\n| RA-T-04 | `VALIDATION_FAILED` 後に成功扱いを要求 | 再試行条件を満たさなければ拒否 |\n| RA-T-05 | 終端状態から同一試行を再開 | 禁止遷移として拒否 |\n| RA-T-06 | `REVIEW_COMPLETE` と `AUTHORIZED` を同時設定 | 明示的許可がなければ拒否 |\n| RA-T-07 | エラー条件が複数成立 | 固定優先順位と副次的失敗記録を適用 |\n| RA-T-08 | 未分類エラーが発生 | 成功に変換せず、未分類障害として停止 |\n| RA-T-09 | 必須証拠の書込みが失敗 | 完了を認めない |\n| RA-T-10 | Freeze 対象のバージョンが未特定 | `FROZEN` を認めない |\n\nこれはテスト計画であり、実行済みの合格結果ではありません。\n\n## **6\\. Step 17 の判定**\n\nSTEP 17\n\nGAPS IDENTIFIED\n\n状態軸間の不正な組合せ、回復・再開条件、エラー分類の排他性、到達可能性検査の受入基準を整理しました。\n\n設計閉包：未成立。 全状態の出辺、意味的レビュー障害、複数障害の裁定、完了条件の形式化が残っています。\n\n実ファイル照合・編集・テスト・Freeze は未実施。GATED を維持。\n\n## **次段階：Step 18 — 状態機械の正規モデルと機械検証契約**\n\n次は、状態遷移を文章の表だけで管理する段階から、機械検証可能なモデルへ移行します。\n\n1. 状態軸と値の正式な列挙  \n2. 遷移の `FROM`／`GUARD`／`ACTION`／`TO` 定義  \n3. 禁止状態組合せの不変条件  \n4. 終端状態・再開条件・試行 ID の契約  \n5. 到達可能性・遷移網羅性・循環検査の検証規則  \n6. 検証結果と証拠の記録形式\n\nこれにより、モデルが生成した説明ではなく、固定された状態機械モデルそのものを決定的に検証できる設計を目指します。\n\n",
  "semantic_kind": "Procedure",
  "semantic_evidence": {
    "phrases": [
      "Step 17 — 状態遷移の網羅性・到達可能性検査"
    ],
    "lines": [
      2554
    ]
  },
  "semantic_attributes": {
    "modality": "none",
    "structural_form": "procedure-block",
    "semantic_strength": "descriptive",
    "semantic_scope": "component-specific"
  },
  "resolution": {
    "status": "resolved",
    "reason": null
  }
}
