{
  "unit_id": "mdsu0027",
  "line_start": 3873,
  "line_end": 4105,
  "source_text": "# **Step 24 — WAL レコード形式・回復アルゴリズム・整合性証明**\n\nMODE \\= DESIGN-ONLY EXECUTION\\_GATE \\= GATED SCOPE \\= WAL FORMAT \\+ RECOVERY \\+ INTEGRITY \\+ IDEMPOTENT REPLAY\n\n目的：Step 23 の Commit 契約を、WAL のレコード構造、起動時の回復手順、異常時の停止条件へ展開します。\n\n中核原則：\n\n* `Canonical History` の確定は、明示された永続化契約に従う。  \n* `WAL` は確定済みイベントを再構成する根拠であり、LLM の提案は根拠にならない。  \n* 回復処理は、欠落・破損・競合を推測で修復しない。  \n* 回復処理の再実行によって、イベントを重複 Commit しない。  \n* 完全性の検査に成功したことと、内容が意味的に正しいことは別の性質である。\n\n## **1\\. WAL レコード形式の候補**\n\n各レコードに共通エンベロープを持たせ、レコード種別ごとのペイロードを分離します。\n\n{\n\n  \"wal\\_format\\_version\": \"WAL-0.1\",\n\n  \"record\\_id\": \"WR-000001\",\n\n  \"sequence\\_no\": 1,\n\n  \"record\\_type\": \"COMMIT\\_EVENT\",\n\n  \"txid\": \"TX-EXAMPLE-001\",\n\n  \"event\\_id\": \"EV-EXAMPLE-001\",\n\n  \"payload\\_digest\": \"DIGEST-PLACEHOLDER\",\n\n  \"previous\\_record\\_digest\": \"DIGEST-PLACEHOLDER\",\n\n  \"payload\": {},\n\n  \"record\\_integrity\": {\n\n    \"algorithm\": \"UNSPECIFIED\",\n\n    \"value\": \"UNSPECIFIED\"\n\n  }\n\n}\n\nこれは設計例であり、実際の WAL 形式・ダイジェスト・完全性値ではありません。\n\n| フィールド | 契約 |\n| ----- | ----- |\n| `wal_format_version` | レコード形式のバージョン |\n| `record_id` | レコードの一意識別子 |\n| `sequence_no` | WAL 内の順序番号 |\n| `record_type` | レコード種別 |\n| `txid` | トランザクション識別子 |\n| `event_id` | Canonical History のイベント識別子。非イベントレコードでは省略可 |\n| `payload_digest` | ペイロード識別用ダイジェスト |\n| `previous_record_digest` | 直前レコードとの連鎖検証用ダイジェスト |\n| `payload` | 種別ごとのデータ |\n| `record_integrity` | 完全性検証方式と検証値 |\n\n`record_id`、`event_id`、`txid` は異なる役割を持ちます。同一視してはいけません。\n\nまた、ダイジェスト連鎖はレコードの変更・順序異常の検出に役立ちますが、単独では真正性を保証しません。攻撃者による全連鎖の再生成まで防ぐ必要がある場合は、署名や信頼されたチェックポイントなどの追加契約が必要です。\n\n## **2\\. レコード種別**\n\n| `record_type` 候補 | 用途 | 正規イベントとしての意味 |\n| ----- | ----- | ----- |\n| `PREPARE` | Commit 候補と前提条件の固定 | 未確定 |\n| `COMMIT_EVENT` | 確定対象イベントの記録 | 永続化条件の検証対象 |\n| `ABORT` | トランザクション中止の記録 | 候補由来の変更なし |\n| `RECOVERY_MARKER` | 回復処理の記録 | 単独では Commit を意味しない |\n| `CHECKPOINT` | 走査開始点などの補助情報 | 対応する契約の範囲内でのみ利用 |\n\n`COMMIT_EVENT` の存在だけで成功と判定できるかは、レコードの完全性、永続化条件、トランザクションの一意性、履歴の連続性に依存します。\n\n別種の `COMMIT_CONFIRMED` レコードを採用する場合は、イベント記録と確定記録の間で障害が発生した際の判定規則が必要です。設計を単純化するなら、確定イベント自体を唯一の Commit 根拠とする方式も比較対象になります。\n\n## **3\\. 起動時の回復アルゴリズム**\n\n回復処理は、通常の提案処理・Commit 処理から分離します。\n\nRECOVERY\\_START\n\n  \\-\\> LOAD\\_STORAGE\\_CONTRACT\n\n  \\-\\> SCAN\\_WAL\n\n  \\-\\> VALIDATE\\_RECORD\\_FRAMING\n\n  \\-\\> VALIDATE\\_RECORD\\_INTEGRITY\n\n  \\-\\> VALIDATE\\_SEQUENCE\\_AND\\_REFERENCES\n\n  \\-\\> RECONSTRUCT\\_TRANSACTION\\_INDEX\n\n  \\-\\> RECONSTRUCT\\_CANONICAL\\_HISTORY\n\n  \\-\\> CHECK\\_TRANSACTION\\_CONSISTENCY\n\n  \\-\\> VERIFY\\_RECOVERY\\_INVARIANTS\n\n  \\-\\> RECOVERY\\_COMPLETE | RECOVERY\\_BLOCKED\n\n### **各段階の規範**\n\n1\\. LOAD\\_STORAGE\\_CONTRACT 対応する WAL 形式、耐久性条件、チェックポイント規則を特定します。未対応の形式なら回復を停止します。\n\n2\\. SCAN\\_WAL 保存された範囲を走査し、レコード境界と走査位置を記録します。\n\n3\\. VALIDATE\\_RECORD\\_FRAMING レコード境界、長さ、必須フィールドを検査します。部分レコードを正常レコードとして解釈しません。\n\n4\\. VALIDATE\\_RECORD\\_INTEGRITY ペイロードの完全性、ダイジェスト連鎖などを検証します。\n\n5\\. VALIDATE\\_SEQUENCE\\_AND\\_REFERENCES 順序番号、ID の一意性、参照先、トランザクションの整合性を検証します。\n\n6\\. RECONSTRUCT\\_TRANSACTION\\_INDEX `txid` ごとに Prepare、Commit、Abort の記録を集約します。\n\n7\\. RECONSTRUCT\\_CANONICAL\\_HISTORY 契約に従って確定済みイベント列を再構成します。未確定候補を確定済み履歴に混入させません。\n\n8\\. CHECK\\_TRANSACTION\\_CONSISTENCY トランザクション状態と履歴イベントの対応を検証します。\n\n9\\. VERIFY\\_RECOVERY\\_INVARIANTS 一意性、順序、履歴不変性、Commit 条件を検証します。\n\n10\\. RECOVERY\\_COMPLETE / RECOVERY\\_BLOCKED 全必須条件が成立した場合にのみ回復完了とします。\n\n## **4\\. レコード異常の分類**\n\n| 異常 | 判定候補 | 回復方針 |\n| ----- | ----- | ----- |\n| 末尾の不完全レコード | `WAL_TAIL_INCOMPLETE` | ストレージ契約に従って隔離・停止 |\n| レコード内部の破損 | `WAL_RECORD_CORRUPT` | 該当範囲を確定根拠に使用しない |\n| 順序番号の欠落 | `WAL_SEQUENCE_GAP` | 原因を照合し、推測補完しない |\n| レコード ID の重複 | `WAL_RECORD_ID_DUPLICATE` | 競合を報告 |\n| `txid` とペイロードの不一致 | `TXID_PAYLOAD_CONFLICT` | 拒否・停止 |\n| 同一トランザクションに矛盾する Commit/Abort | `TXN_TERMINAL_CONFLICT` | `RECOVERY_BLOCKED` |\n| Commit と履歴の不一致 | `HISTORY_COMMIT_MISMATCH` | 確定を保留し照合 |\n| 未対応の WAL 形式 | `WAL_VERSION_UNSUPPORTED` | 回復停止 |\n\nこれらはエラーコード候補です。最終的なコード体系と分類は未確定です。\n\n末尾の不完全レコードを切り捨ててよいかは、一般則として決めません。 不完全レコードが耐久化済みの確定イベントを含まないと証明できること、切り捨て位置が特定できること、元データを監査可能な形で保持できることなど、明示的な前提が必要です。証明できなければ `RECOVERY_BLOCKED` とします。\n\n## **5\\. `IN_DOUBT` の確定・中止条件**\n\n回復時に、次の分類を使用する候補を定義します。\n\n| 観測結果 | 回復判定 |\n| ----- | ----- |\n| Commit イベントが完全で、必要な耐久性条件を満たす | `COMMITTED` |\n| Abort が有効で、Commit と矛盾しない | `ABORTED` |\n| Prepare のみが存在 | 未確定。明示的な回復規則を適用 |\n| Commit 候補が部分書込み状態 | 未確定。完全性と耐久性を照合 |\n| Commit と Abort が競合 | `RECOVERY_BLOCKED` |\n| 履歴の欠落・破損により確定不能 | `IN_DOUBT` または `RECOVERY_BLOCKED` |\n\nPrepare のみが存在する場合でも、直ちに Abort してよいとは限りません。外部副作用がすでに発生していないか、Commit が別の耐久記録に存在しないかを検証する必要があります。\n\n確定結果を一意に判定できない場合は、推測による Commit、Abort、再追記を禁止します。\n\n## **6\\. 回復処理の冪等性**\n\n回復処理は同じ永続状態に対して複数回実行しても、Canonical History の結果が変化しない必要があります。\n\n$Recover(H)=S$\n\n$Recover(H)=S\\Rightarrow Recover(H)=S$\n\nここで $H$ は同一の有効な WAL と回復に必要な固定入力、$S$ は再構成された正規状態です。実際の契約では、ストレージ契約、モデルバージョン、回復アルゴリズムのバージョンも固定します。\n\n回復処理が `RECOVERY_MARKER` などを追記する場合、その追記は冪等な回復キーまたは一意性規則に従い、同一の回復を繰り返すことで矛盾した記録を増やさないようにします。\n\n## **7\\. 整合性の受入条件**\n\n回復を成功と判定するには、少なくとも次を満たす必要があります。\n\n* 必須範囲のレコード境界と完全性が検証されている。  \n* 順序番号・ID・参照関係に未解決の矛盾がない。  \n* Commit と履歴イベントの対応が一意に定まる。  \n* 未確定トランザクションが確定済み履歴へ混入していない。  \n* 同一 `txid` の再処理で重複 Commit が発生しない。  \n* Projection は Canonical History から再構築できる。  \n* 回復後の状態が定義済みの不変条件を満たす。  \n* 検証器の障害や証拠不足を回復成功として扱っていない。\n\nこれらのいずれかが検証不能なら、回復結果を `RECOVERY_COMPLETE` として確定しません。\n\n## **8\\. 受入試験候補**\n\n| TEST\\_ID | 試験条件 | 期待結果 |\n| ----- | ----- | ----- |\n| WAL-T-01 | 正常な WAL を走査 | 履歴を決定論的に再構成 |\n| WAL-T-02 | 末尾を切断 | 不完全レコードを検出 |\n| WAL-T-03 | 中間レコードを破損 | 破損を検出し、黙って通過しない |\n| WAL-T-04 | 順序番号を欠落させる | `WAL_SEQUENCE_GAP` 候補 |\n| WAL-T-05 | 同一 `txid` に異なるペイロード | 競合として停止 |\n| WAL-T-06 | 同一 `txid` に Commit と Abort | `RECOVERY_BLOCKED` |\n| WAL-T-07 | Prepare のみを保存 | 明示的な回復規則を適用 |\n| WAL-T-08 | 同じ WAL で回復を反復 | Canonical History が不変 |\n| WAL-T-09 | Commit 記録と履歴が不一致 | 確定保留 |\n| WAL-T-10 | 未対応形式で起動 | `WAL_VERSION_UNSUPPORTED` |\n\nこれらは設計上の試験候補であり、実行済みではありません。\n\n## **9\\. Step 24 判定**\n\nSTEP 24\n\nRECOVERY CONTRACT DRAFTED\n\n定義済み：WAL 共通エンベロープ、レコード種別候補、起動時回復手順、異常分類、`IN_DOUBT` の扱い、回復の冪等性、受入条件。\n\n未確定：実際のバイナリ／JSON レコード形式、耐久性モデル、末尾切断時の復旧条件、チェックポイント方式、イベント連鎖の真正性、具体的な回復実装。\n\n実ファイル照合・編集・テスト・Freeze は未実施。EXECUTION\\_GATE \\= GATED。\n\n## **次段階：Step 25 — Canonical History のイベント契約と履歴再生意味論**\n\n次は、WAL の格納契約から一段進み、履歴イベント自体の意味を定義します。\n\n1. イベントの必須フィールドと一意性  \n2. イベント順序と因果関係の表現  \n3. Commit イベントと監査イベントの区別  \n4. 状態再構築関数 `fold(History)` の意味論  \n5. 同一履歴・同一規則からの決定論的再生  \n6. 履歴バージョン移行と旧履歴の互換性  \n7. 履歴だけでは復元できない外部依存の記録規則\n\nこの段階では、WAL が正しく保存されていることと、そのイベント列から正しい状態を再構築できることを別々に検証する契約を目指します。\n\n",
  "semantic_kind": "Unclassified",
  "semantic_evidence": {
    "phrases": [
      "回復処理は、欠落・破損・競合を推測で修復しない。",
      "確定結果を一意に判定できない場合は、推測による Commit、Abort、再追記を禁止します。",
      "回復処理は、通常の提案処理・Commit 処理から分離します。",
      "これは設計例であり、実際の WAL 形式・ダイジェスト・完全性値ではありません。",
      "これらはエラーコード候補です。最終的なコード体系と分類は未確定です。"
    ],
    "lines": [
      3883,
      4034,
      3956,
      3921,
      4015
    ]
  },
  "semantic_attributes": {
    "modality": "none",
    "structural_form": "other",
    "semantic_strength": "none",
    "semantic_scope": "unspecified"
  },
  "resolution": {
    "status": "ambiguous",
    "reason": "multiple_plausible_interpretations",
    "candidate_kinds": [
      "Requirement",
      "Constraint",
      "Procedure",
      "Description"
    ]
  }
}
