{
  "unit_id": "mdsu0032",
  "line_start": 5065,
  "line_end": 5313,
  "source_text": "# **Step 29 — Policy Versioning / Revocation / TOCTOU Contract**\n\nMODE \\= DESIGN-ONLY EXECUTION\\_GATE \\= GATED STATUS \\= CONTRACT DRAFT\n\nOBJECTIVE:\n\n`POLICY SNAPSHOT → AUTHORIZATION → TARGET BINDING → COMMIT-TIME CHECK → DURABLE COMMIT`\n\n中心原則：認可判定時点の正当性と、Commit 時点の実行許可を区別する。過去の認可記録を書き換えず、失効・再評価・回復の規則を明示する。\n\n## **29.1 Policy Version Identity**\n\nポリシーは変更可能な名前だけで参照せず、不変のバージョン識別子と内容ダイジェストで特定する。\n\n{\n\n  \"policy\\_id\": \"COMMIT\\_AUTHORIZATION\",\n\n  \"policy\\_version\": \"1.0\",\n\n  \"policy\\_digest\": \"DIGEST-PLACEHOLDER\",\n\n  \"policy\\_status\": \"ACTIVE\",\n\n  \"effective\\_from\": \"TIMESTAMP-PLACEHOLDER\",\n\n  \"revocation\\_policy\\_ref\": \"REVOCATION-POLICY-1\"\n\n}\n\n形式例。実際のポリシー・ダイジェスト・時刻ではない。\n\n必須候補：\n\n* `policy_id`  \n* `policy_version`  \n* `policy_digest`  \n* `policy_status`  \n* `effective_from`  \n* 失効規則への参照\n\n規範候補：\n\n1. 公開済みポリシーバージョンの内容を上書きしない。  \n2. 内容が変われば、新しいバージョンとして識別する。  \n3. バージョン番号とダイジェストを独立に検証する。  \n4. 適用対象のポリシーを特定できない場合、認可成功を推測しない。  \n5. ポリシーの有効期間・失効の意味論は、明示的な契約として定義する。\n\n## **29.2 Authorization Record**\n\n認可結果は、要求対象・適用ポリシー・判定結果を一つの不変記録として関連付ける。\n\n| Field | Purpose |\n| ----- | ----- |\n| `authorization_id` | 認可記録の識別子 |\n| `request_id` | 認可要求の識別子 |\n| `principal_id` | 要求主体 |\n| `action` | 許可を求める操作 |\n| `resource` | 対象リソース |\n| `target_digest` | 認可対象の内容識別 |\n| `policy_id` / `policy_version` | 適用ポリシー |\n| `policy_digest` | 適用ポリシーの内容確認 |\n| `decision` | `ALLOW / DENY / INDETERMINATE / POLICY_ERROR` |\n| `decision_evidence_refs` | 判定根拠への参照 |\n| `decision_time` | 時刻が必要な場合の判定時刻 |\n| `validity_rule_ref` | 認可の有効性規則 |\n\n`ALLOW` は認可記録の結果であり、Commit 成功の証明ではない。\n\n## **29.3 TOCTOU — Authorization と Commit の間の競合**\n\nTOCTOU（Time-of-Check to Time-of-Use）とは、検査時と実行時の間に対象や権限条件が変化する問題である。\n\n例：\n\n1. Policy v1 で Commit を認可する。  \n2. 認可後に Policy v1 が失効する。  \n3. Commit が開始される。\n\nこの場合の結果は、明示的な失効契約がなければ決定できない。\n\n対策候補：\n\n* Target binding: 認可対象と Commit 対象のダイジェストを照合する。  \n* Policy pinning: 認可時のポリシー・バージョンとダイジェストを記録する。  \n* Commit-time validation: Commit 時点で必要な条件を再検証する。  \n* Atomic authorization boundary: 認可と Commit の間で変化してはならない条件を、Kernel の直列化または同等の同期契約で保護する。  \n* Explicit revocation semantics: 失効が未実行の認可へどう影響するかを規定する。\n\n単に認可直後に再検証するだけでは、再検証後から Commit までの競合を完全には防げない。\n\n## **29.4 Revocation Semantics**\n\n失効の対象を分ける。\n\n| Revocation scope | 意味 |\n| ----- | ----- |\n| `POLICY_VERSION` | ポリシーバージョン自体の新規適用を停止 |\n| `PRINCIPAL` | 主体の権限を停止 |\n| `AUTHORIZATION_RECORD` | 個別の認可を無効化 |\n| `PENDING_OPERATION` | 未 Commit の操作を停止 |\n| `CREDENTIAL` | 認証情報の使用を停止 |\n\n重要な区別：\n\n* 過去の確定 Commit: 失効によって自動的に消去・取消ししない。  \n* 未 Commit の認可済み操作: 失効が影響するかは明示的な規則に従う。  \n* Commit 結果不明の操作: 失効だけを理由に再実行・取消しを推測しない。  \n* 新規要求: 現在適用される認可規則に従って判定する。\n\n過去のイベントを新しいポリシーで再判定して履歴を改変することは禁止する。監査上の再評価が必要なら、元の判定と区別した新しい監査記録として保存する。\n\n## **29.5 Commit-Time Decision Contract**\n\nCommit 時の処理候補：\n\n1\\. LOAD\\_AUTHORIZATION\\_RECORD\n\n2\\. VERIFY\\_AUTHORIZATION\\_INTEGRITY\n\n3\\. VERIFY\\_TARGET\\_BINDING\n\n4\\. VERIFY\\_POLICY\\_VERSION\n\n5\\. EVALUATE\\_REVOCATION\\_RULES\n\n6\\. VERIFY\\_REQUIRED\\_CURRENT\\_CONDITIONS\n\n7\\. ESTABLISH\\_COMMIT\\_SERIALIZATION\\_BOUNDARY\n\n8\\. COMMIT\\_OR\\_REJECT\n\n9\\. RECORD\\_OUTCOME\n\n判定規則：\n\n* 対象の不一致 → 拒否  \n* 認可記録の破損・不整合 → 認可検証失敗  \n* 必要なポリシー情報が不足 → 保留  \n* 失効が有効と確定 → 拒否  \n* 現在条件を判定できない → 保留  \n* すべての条件を満たす → Commit 処理へ進行\n\nただし、どの条件を Commit 時点で再評価するか、どの条件を認可時点で固定するかは、ポリシーごとに明示する必要がある。\n\n## **29.6 Retry / Recovery Contract**\n\n再試行時に、新規認可と既存認可のどちらを使用するかを明示する。\n\n| 状況 | 規則候補 |\n| ----- | ----- |\n| Commit 前の一時的障害 | 有効性と対象の一致を再確認 |\n| 認可の期限切れ | 再認可 |\n| 主体の失効 | 規定に従い拒否 |\n| Policy version の失効 | 失効規則に従い再認可または拒否 |\n| `IN_DOUBT` | 先に耐久済みイベントを照合 |\n| 同一 `txid`・同一要求 | 既存結果を照合し、二重 Commit を防止 |\n| 同一 `txid`・異なる要求 | 拒否 |\n| 過去の確定イベントの Replay | 当時の記録された規範・証拠を使用 |\n\n禁止： 回復処理が認可失敗を自動的に迂回すること、または不明な Commit を再実行して結果を推測すること。\n\n## **29.7 Failure Taxonomy**\n\nPOLICY\\_VERSION\\_UNKNOWN\n\nPOLICY\\_DIGEST\\_MISMATCH\n\nPOLICY\\_VERSION\\_REVOKED\n\nAUTHORIZATION\\_REVOKED\n\nAUTHORIZATION\\_EXPIRED\n\nAUTHORIZATION\\_TARGET\\_MISMATCH\n\nAUTHORIZATION\\_RECORD\\_INVALID\n\nPRINCIPAL\\_REVOKED\n\nCREDENTIAL\\_REVOKED\n\nCOMMIT\\_TIME\\_POLICY\\_UNAVAILABLE\n\nTOCTOU\\_GUARD\\_FAILED\n\nREVOCATION\\_STATE\\_UNKNOWN\n\nAUTHORIZATION\\_REVALIDATION\\_REQUIRED\n\n`*_UNKNOWN` と `*_REVOKED` は区別する。情報が取得できないことは、失効が確定したことを意味しない。ただし、必要な認可条件を検証できない場合は Commit を許可しない。\n\n## **29.8 Invariants**\n\n* POL-INV-01: ポリシーバージョンの内容は不変である。  \n* POL-INV-02: 認可記録は対象・操作・ポリシーに束縛される。  \n* POL-INV-03: 対象の変更後に旧認可を無条件で再利用しない。  \n* POL-INV-04: `ALLOW` だけでは Commit 成功にならない。  \n* POL-INV-05: 失効した権限による新規操作を許可しない。  \n* POL-INV-06: 過去の確定イベントを失効だけで書き換えない。  \n* POL-INV-07: `IN_DOUBT` は耐久性の証拠に基づいて解決する。  \n* POL-INV-08: 再試行によって認可制約を迂回しない。  \n* POL-INV-09: 不明な失効状態を有効と推測しない。  \n* POL-INV-10: Replay の歴史的解釈と現在の認可判定を混同しない。\n\n## **29.9 Acceptance Tests**\n\n| Test ID | ケース | 期待結果 |\n| ----- | ----- | ----- |\n| POL-T-01 | 同じバージョン ID・異なるポリシーダイジェスト | 不整合を検出 |\n| POL-T-02 | 認可後に対象ペイロードを変更 | 拒否 |\n| POL-T-03 | Commit 前に認可が失効 | 失効契約に従って停止 |\n| POL-T-04 | 失効情報を取得できない | Commit を保留 |\n| POL-T-05 | 認可後に主体が失効 | 明示的な Commit 時条件を適用 |\n| POL-T-06 | Commit 成功後にポリシーが失効 | 過去の履歴を自動変更しない |\n| POL-T-07 | `IN_DOUBT` から再試行 | 先に耐久済みイベントを照合 |\n| POL-T-08 | 古い規範を用いた Replay | 履歴に対応する規範を使用 |\n| POL-T-09 | 再認可時にポリシーが変更 | 新しい判定記録を作成 |\n| POL-T-10 | 認可直後に失効・Commit が競合 | 直列化・失効規則に従い一意の結果 |\n\n試験は未実行。特に POL-T-03、POL-T-05、POL-T-10 の確定には、失効の有効時点と Commit の直列化境界を形式的に定義する必要がある。\n\n## **29.10 Step 29 判定**\n\nSTEP 29\n\nCONTRACT DRAFTED\n\n定義候補：不変ポリシーバージョン、認可記録、対象束縛、TOCTOU 対策、失効範囲、再試行・回復、歴史的 Replay。\n\n未解決：失効の線形化時点、Commit との原子性、認可有効期間、ポリシー更新時の移行規則、分散環境での失効状態の一貫性。\n\n設計案のみ。実装・テスト・正式採用・Freeze は未実施。EXECUTION\\_GATE \\= GATED。\n\n## **Step 30 — Kernel Commit Linearization / Concurrency Control**\n\n次段階では、複数の要求・認可・失効・Commit が競合した場合に、Canonical History の確定順序を一意にする契約を定義する。\n\n1. Commit の線形化点（linearization point）  \n2. `history_sequence` の割当てと一意性  \n3. 同時要求の直列化・競合検出  \n4. 認可・失効・Commit の順序関係  \n5. `txid` と冪等性キーの並行処理契約  \n6. 部分障害・タイムアウト時の `IN_DOUBT` 解決  \n7. 線形化可能性・履歴一貫性の検証条件\n\n中心課題： Kernel が唯一の Commit 権限を持つだけでは不十分である。競合する操作について、どの操作が先に確定したかを、耐久性のある履歴から一意に再構築できなければならない。\n\n",
  "semantic_kind": "Unclassified",
  "semantic_evidence": {
    "phrases": [
      "# **Step 29 — Policy Versioning / Revocation / TOCTOU Contract**",
      "ポリシーは変更可能な名前だけで参照せず、不変のバージョン識別子と内容ダイジェストで特定する。",
      "過去のイベントを新しいポリシーで再判定して履歴を改変することは禁止する。",
      "Commit 時の処理候補：",
      "TOCTOU（Time-of-Check to Time-of-Use）とは、検査時と実行時の間に対象や権限条件が変化する問題である。",
      "設計案のみ。実装・テスト・正式採用・Freeze は未実施。"
    ],
    "lines": [
      5065,
      5313
    ]
  },
  "semantic_attributes": {
    "modality": "none",
    "structural_form": "other",
    "semantic_strength": "none",
    "semantic_scope": "unspecified"
  },
  "resolution": {
    "status": "ambiguous",
    "reason": "multiple_plausible_interpretations",
    "candidate_kinds": [
      "Heading",
      "Requirement",
      "Constraint",
      "Definition",
      "Procedure",
      "Exception"
    ]
  }
}
