{
  "unit_id": "mdsu0037",
  "line_start": 6341,
  "line_end": 6673,
  "source_text": "# **Step 34 — Backup / Restore / Disaster Recovery Contract**\n\nPROJECT \\= Chron-LLM\n\nSTEP \\= 34\n\nSTATUS \\= DESIGN\\_DRAFT\n\nEXECUTION\\_GATE \\= GATED\n\nCODE\\_CHANGE \\= PROHIBITED\n\nTEST\\_EXECUTION \\= NOT\\_PERFORMED\n\nFREEZE \\= NOT\\_AUTHORIZED\n\n## **34.1 目的**\n\nBackup・Restore・Disaster Recovery（DR）において、Canonical History の完全性、Commit の一意性、認可証拠の整合性、復旧結果の決定性を維持する。\n\n設計目標：\n\nBACKUP\n\n  \\-\\> INTEGRITY\\_VERIFICATION\n\n  \\-\\> RECOVERY\\_POINT\\_VALIDATION\n\n  \\-\\> RESTORE\\_TO\\_ISOLATED\\_TARGET\n\n  \\-\\> CANONICAL\\_HISTORY\\_RECONSTRUCTION\n\n  \\-\\> TRANSACTION\\_RECONCILIATION\n\n  \\-\\> REPLAY\\_VERIFICATION\n\n  \\-\\> AUTHORIZATION\\_EVIDENCE\\_VERIFICATION\n\n  \\-\\> RECOVERY\\_ACCEPTANCE\n\n基本原則：\n\n* Backup は Canonical History そのものではなく、その復元可能性を支える保存物である。  \n* Restore は本番状態への即時上書きではない。  \n* Digest の一致だけでは、Backup の完全性・意味的整合性・復元可能性を証明できない。  \n* 復旧元が複数あり、その間に矛盾がある場合、根拠なく一方を選択しない。  \n* Recovery 完了前に Commit を再開しない。  \n* DR は、単にプロセスを起動することではなく、正本とトランザクションの整合性を検証することで成立する。\n\n## **34.2 Backup Scope Contract**\n\nBackup 対象は、復元に必要なデータと、復元後に再生成できるデータを区別して定義する。\n\n| 分類 | 対象候補 | Backup 上の要件 |\n| ----- | ----- | ----- |\n| `CANONICAL_DATA` | Canonical History | 欠落・改変・順序矛盾を検出可能にする |\n| `COMMIT_RECOVERY_DATA` | WAL、未解決トランザクション記録 | Commit 状態を判定できる証拠を保持する |\n| `AUTHORITY_DATA` | Policy、Event Registry、規範バージョン | 過去の Commit を解釈・検証できるようにする |\n| `AUTHORIZATION_EVIDENCE` | Authorization Record、Revocation 記録 | Commit 時点の認可根拠を検証できるようにする |\n| `RECOVERY_ANCHORS` | Checkpoint、信頼できる基準点 | History 境界との対応を検証する |\n| `DERIVED_DATA` | Snapshot、Projection、Transaction Index | 再生成可能性と再生成コストを評価する |\n| `OPERATIONAL_CONFIG` | Recovery・Storage の構成 | 復旧に必要な設定とバージョンを特定する |\n| `SECRET_MATERIAL` | 必要な秘密情報・鍵管理参照 | 別のアクセス制御・復元規範に従う |\n\nすべてを一律にバックアップするのではなく、各対象について以下を定義する。\n\nbackup\\_required\n\nrebuildable\n\nrecovery\\_dependency\n\nintegrity\\_verification\n\nretention\\_policy\\_ref\n\nrestore\\_authority\n\n`rebuildable=true` であっても、再生成に必要な入力や規範が失われていれば復元可能とはみなさない。\n\n## **34.3 Backup Consistency Contract**\n\nBackup は、異なる時点のデータを無条件に寄せ集めたものではなく、復元対象の整合性境界が特定できる単位として扱う。\n\n候補メタデータ：\n\n{\n\n  \"backup\\_schema\\_version\": \"UNSET\",\n\n  \"backup\\_id\": \"UNSET\",\n\n  \"backup\\_mode\": \"UNSET\",\n\n  \"recovery\\_point\\_id\": \"UNSET\",\n\n  \"history\\_sequence\": \"UNSET\",\n\n  \"history\\_head\\_digest\": \"UNSET\",\n\n  \"wal\\_boundary\": \"UNSET\",\n\n  \"transaction\\_state\\_digest\": \"UNSET\",\n\n  \"normative\\_version\": \"UNSET\",\n\n  \"registry\\_version\": \"UNSET\",\n\n  \"artifact\\_manifest\\_digest\": \"UNSET\",\n\n  \"integrity\\_status\": \"UNSET\"\n\n}\n\nこれはフィールド候補であり、採用済み Schema ではない。\n\n### **必須条件候補**\n\n1. Backup の対象範囲と整合性境界が明示されている。  \n2. Canonical History と WAL の対応を検証できる。  \n3. Backup 時点の未解決トランザクションを識別できる。  \n4. 必要な Replay・Policy・Registry のバージョンを特定できる。  \n5. Backup 対象の完全性と参照整合性を検証できる。  \n6. Backup 中に Commit が進行する場合、その競合を処理する方式が Storage Contract で定義されている。  \n7. 整合性境界を確定できない Backup は、復旧可能な正本として採用しない。\n\n未確定事項： 一貫性スナップショット、WAL の境界確定、同時書き込みとの同期方式は Storage Contract に依存する。\n\n## **34.4 Recovery Point と RPO / RTO**\n\nDR の目標値は、実際の運用要件から決める。ここでは数値を仮定しない。\n\n* RPO（Recovery Point Objective）：許容可能なデータ損失の上限。  \n* RTO（Recovery Time Objective）：復旧完了までに許容される時間。  \n* Recovery Point：復元に使用する、整合性を検証可能な時点。  \n* Recovery Acceptance：復元後の検証を通過し、運用再開が明示的に許可された状態。\n\nRecovery Point が最新であることと、信頼できることは別条件である。\n\n候補ポリシー：\n\nRPO\\_TARGET \\= UNSET\n\nRTO\\_TARGET \\= UNSET\n\nRECOVERY\\_POINT\\_SELECTION\\_POLICY \\= UNSET\n\nMAX\\_ACCEPTABLE\\_DATA\\_LOSS \\= UNSET\n\nRECOVERY\\_ACCEPTANCE\\_AUTHORITY \\= UNSET\n\n最新の Backup が破損している場合、より古い検証済み Backup を選択する候補はある。ただし、古い Recovery Point を選ぶことによるデータ損失と、以後の Commit 証拠との整合性を評価せずに切り替えてはならない。\n\n## **34.5 Restore State Machine**\n\nRESTORE\\_REQUESTED\n\n  \\-\\> RESTORE\\_AUTHORIZED\n\n  \\-\\> BACKUP\\_SELECTED\n\n  \\-\\> BACKUP\\_INTEGRITY\\_VERIFIED\n\n  \\-\\> RESTORE\\_TARGET\\_ISOLATED\n\n  \\-\\> ARTIFACTS\\_RESTORED\n\n  \\-\\> CANONICAL\\_HISTORY\\_VERIFIED\n\n  \\-\\> WAL\\_RECONCILED\n\n  \\-\\> TRANSACTIONS\\_RECONCILED\n\n  \\-\\> REPLAY\\_VERIFIED\n\n  \\-\\> AUTHORITY\\_AND\\_POLICY\\_VERIFIED\n\n  \\-\\> RECOVERY\\_ACCEPTANCE\\_PENDING\n\n  \\-\\> RECOVERY\\_ACCEPTED\n\n  \\-\\> SERVICE\\_RESUME\\_AUTHORIZED\n\n例外状態：\n\nRESTORE\\_REJECTED\n\nBACKUP\\_INVALID\n\nRESTORE\\_INCOMPLETE\n\nRECOVERY\\_IN\\_DOUBT\n\nRECOVERY\\_BLOCKED\n\nREPLAY\\_DIVERGENCE\n\nAUTHORITY\\_EVIDENCE\\_MISSING\n\nRECOVERY\\_ACCEPTANCE\\_DENIED\n\n`RESTORE_COMPLETED` と `SERVICE_RESUME_AUTHORIZED` は同じ状態ではない。データの復元に成功しても、Commit の安全な再開が許可されたとは限らない。\n\n## **34.6 Transaction Reconciliation Contract**\n\nBackup の取得時点と障害発生時点が異なる場合、未確定トランザクションの判定が必要になる。\n\n| 復旧時に確認された証拠 | 判定候補 | 動作 |\n| ----- | ----- | ----- |\n| Backup と残存 WAL に完全な Commit 証拠がある | `COMMITTED` | 既存結果を復元し、再 Commit を禁止 |\n| 有効な Abort 証拠があり、矛盾がない | `ABORTED` | 明示的な再試行規範を適用 |\n| Prepare のみ確認できる | `IN_DOUBT` または規定済み未確定状態 | Recovery Policy に従って照合 |\n| Commit の有無を証明できない | `IN_DOUBT` | 再 Commit を禁止 |\n| Commit と Abort の証拠が競合 | `RECOVERY_BLOCKED` | 自動選択を禁止 |\n| Backup と WAL の整合性が成立しない | `RECOVERY_BLOCKED` | 正本の自動再構築を禁止 |\n| Backup 後に確定した Event の証拠が存在する | 検証済み証拠に応じて判定 | 順序・参照・耐久性を検証して適用可否を判断 |\n\nBackup 時点以降の Event を適用するには、対象 Event が正規の Canonical History に属することと、その適用順序が証明される必要がある。単に WAL に存在するという理由だけでは不十分。\n\n## **34.7 Disaster Recovery と Commit 再開**\n\nDR 復旧中は、通常の Commit 処理を停止または制限する必要がある。具体的な排他方式は未確定だが、復旧対象と通常処理が競合して二重 Commit を生まないことを保証しなければならない。\n\nサービス再開前の条件候補：\n\n* Canonical History の完全性を確認できる。  \n* WAL と Transaction Index の整合性を確認できる。  \n* `IN_DOUBT` トランザクションの処理が規範に従っている。  \n* Replay 結果が期待される状態と一致する。  \n* Policy、Registry、Replay 規範のバージョンが特定されている。  \n* Authorization・Revocation の必要な証拠が検証されている。  \n* Snapshot・Projection 等の派生物が正本と整合するか、再生成対象として分離されている。  \n* 復旧を受理する権限主体が、検証結果を基に明示的に承認している。\n\n検証が完了していない場合は `RECOVERY_BLOCKED` または `RECOVERY_ACCEPTANCE_PENDING` を維持する。\n\n## **34.8 Failure Matrix**\n\n| 障害・不整合 | 判定候補 | 動作 |\n| ----- | ----- | ----- |\n| Backup の Digest 不一致 | `BACKUP_INVALID` | 当該 Backup を復旧元として採用しない |\n| History と WAL の境界が不一致 | `RECOVERY_BLOCKED` | 根拠なく結合しない |\n| 必要な Policy が欠落 | `AUTHORITY_EVIDENCE_MISSING` | Commit の意味を推測しない |\n| Replay 結果が一致しない | `REPLAY_DIVERGENCE` | サービス再開を禁止 |\n| 未解決トランザクションが残る | `RECOVERY_IN_DOUBT` | 明示的な Recovery 規範で処理 |\n| Restore 中にクラッシュ | `RESTORE_INCOMPLETE` | 部分復元を本番正本として採用しない |\n| Recovery Acceptance が拒否された | `RECOVERY_ACCEPTANCE_DENIED` | Commit 再開を禁止 |\n| 復旧元が複数あり互いに矛盾 | `RECOVERY_BLOCKED` | 自動的な優先順位付けを禁止 |\n\n## **34.9 Fault Injection Tests**\n\n以下はテスト設計候補であり、未実行。\n\n| Test ID | 条件 | 期待結果 |\n| ----- | ----- | ----- |\n| `DR-T-01` | 正常な Backup から復元 | Canonical State を検証できる |\n| `DR-T-02` | Backup 内の History を改変 | 完全性検証に失敗 |\n| `DR-T-03` | WAL の一部が欠落 | 必要な証拠が不足する場合は復旧を停止 |\n| `DR-T-04` | Backup と WAL の境界を不一致にする | `RECOVERY_BLOCKED` |\n| `DR-T-05` | Prepare-only トランザクションを含む | 未確定状態を保持し、推測で確定しない |\n| `DR-T-06` | Commit 後に ACK を喪失した要求を復元 | 二重 Commit を発生させない |\n| `DR-T-07` | 必要な規範バージョンを欠落させる | 復旧受理を拒否 |\n| `DR-T-08` | Restore 中にプロセスクラッシュ | 部分復元を本番正本として採用しない |\n| `DR-T-09` | Snapshot を破損させる | Canonical History を保持し、Snapshot を拒否 |\n| `DR-T-10` | 同一 Backup と同一固定入力で複数回復旧 | 同一の Canonical State を得る |\n| `DR-T-11` | 矛盾する複数 Backup を提示 | 根拠なく一方を選ばない |\n| `DR-T-12` | Recovery Acceptance 前に Commit を要求 | Commit 再開を拒否 |\n| `DR-T-13` | Authorization Evidence を欠落させる | 必要な認可検証ができなければ受理を拒否 |\n| `DR-T-14` | 復旧後の Transaction Index を再構築 | Canonical History と一致 |\n| `DR-T-15` | 復旧完了後に同一要求を再送 | 冪等性を維持し、既存結果を返す |\n\n## **34.10 Invariants**\n\nDR-INV-01: BACKUP\\_IS\\_NOT\\_CANONICAL\\_AUTHORITY\n\nDR-INV-02: RESTORE\\_MUST\\_VALIDATE\\_INTEGRITY\\_AND\\_CONSISTENCY\n\nDR-INV-03: RESTORE\\_COMPLETION \\!= SERVICE\\_RESUME\\_AUTHORIZATION\n\nDR-INV-04: UNRESOLVED\\_TXN\\_MUST\\_NOT\\_BE\\_GUESSED\n\nDR-INV-05: SAME\\_COMMITTED\\_TXID\\_MUST\\_NOT\\_BE\\_COMMITTED\\_AGAIN\n\nDR-INV-06: BACKUP\\_CONFLICT\\_MUST\\_BLOCK\\_AUTOMATIC\\_SELECTION\n\nDR-INV-07: REPLAY\\_DIVERGENCE\\_MUST\\_BLOCK\\_RECOVERY\\_ACCEPTANCE\n\nDR-INV-08: REQUIRED\\_AUTHORITY\\_EVIDENCE\\_MUST\\_BE\\_VERIFIABLE\n\nDR-INV-09: RECOVERY\\_MUST\\_BE\\_DETERMINISTIC\\_FOR\\_FIXED\\_INPUTS\n\nDR-INV-10: DERIVED\\_ARTIFACTS\\_MUST\\_NOT\\_OVERRIDE\\_CANONICAL\\_HISTORY\n\nDR-INV-11: RECOVERY\\_ACCEPTANCE\\_REQUIRES\\_EXPLICIT\\_AUTHORITY\n\nDR-INV-12: COMMIT\\_MUST\\_NOT\\_RESUME\\_BEFORE\\_RECOVERY\\_ACCEPTANCE\n\n## **34.11 未確定事項**\n\n1. Backup の整合性取得方式と、Commit 中の Backup 境界確定方法。  \n2. RPO・RTO と Recovery Point 選択規範。  \n3. Backup・WAL・Checkpoint の優先順位と信頼の起点。  \n4. DR 中の Commit 停止・排他・再開の具体的契約。  \n5. Authorization・Revocation Evidence の復元要件。  \n6. 秘密鍵・資格情報のバックアップと復旧手順。  \n7. 複数復旧拠点・複数 Backup 間の競合解消規範。  \n8. Recovery Acceptance の主体・証拠・監査記録。  \n9. Storage Contract と Retention Policy の未確定事項。\n\n## **Step 34 判定**\n\nDESIGN\\_DRAFT \\= COMPLETE\n\nBACKUP\\_CONSISTENCY\\_CONTRACT \\= PROVISIONAL\n\nRESTORE\\_CONTRACT \\= PROVISIONAL\n\nDISASTER\\_RECOVERY\\_POLICY \\= UNRESOLVED\n\nRPO\\_RTO \\= UNSET\n\nFAULT\\_TESTS \\= SPECIFIED\\_NOT\\_EXECUTED\n\nCODE\\_CHANGE \\= NOT\\_PERFORMED\n\nFREEZE \\= NOT\\_AUTHORIZED\n\nEXECUTION\\_GATE \\= GATED\n\n次段階：Step 35 — Observability / Audit Logging / Operational Telemetry Contract\n\n目的は、Kernel の Commit・Recovery・Policy 判定・Projection 更新を観測可能にしつつ、Telemetry を Canonical Truth と混同せず、ログ欠落や監視障害が Commit の意味や正当性を変えないための規範を定義することです。Step 31〜34 の未確定事項は引き継ぎ、未定義の Storage・Retention・DR 要件を暗黙に確定しません。\n\n",
  "semantic_kind": "Requirement",
  "semantic_evidence": {
    "phrases": [
      "Backup / Restore / Disaster Recovery Contract",
      "必須条件候補",
      "Commit を再開しない",
      "自動選択を禁止",
      "Commit 再開を禁止"
    ],
    "lines": [
      6341,
      6387,
      6457,
      6554,
      6587
    ]
  },
  "semantic_attributes": {
    "modality": "must",
    "structural_form": "other",
    "semantic_strength": "strong",
    "semantic_scope": "system-wide"
  },
  "resolution": {
    "status": "resolved",
    "reason": null
  }
}
