{
  "unit_id": "mdsu0026",
  "line_start": 3681,
  "line_end": 3872,
  "source_text": "# **Step 23 — Commit・履歴追記の原子性と障害回復契約**\n\nMODE \\= DESIGN-ONLY EXECUTION\\_GATE \\= GATED OBJECTIVE \\= COMMIT AUTHORITY \\+ WAL ATOMICITY \\+ CRASH RECOVERY \\+ DUPLICATE SUPPRESSION\n\n本段階では、Chron-LLM の `History = Canonical Truth` を維持するため、Commit 判定と履歴永続化の間で障害が発生した場合の規範を定義します。\n\n最重要原則は、メモリ上の成功判定、LLM の出力、呼出元への応答だけでは Commit 成功を確定しないことです。確定条件は、永続化契約に従って検証された Canonical History とトランザクション記録に置きます。\n\n## **1\\. トランザクション状態**\n\n| 状態 | 意味 | 正規状態への反映 |\n| ----- | ----- | ----- |\n| `PREPARED` | Commit 候補の検証が完了 | 未確定 |\n| `COMMITTING` | 永続化処理を開始 | 未確定 |\n| `COMMITTED` | Commit が規定の耐久性条件を満たした | 確定 |\n| `REJECTED` | 候補が規範条件に不適合 | 候補由来の変更なし |\n| `ABORTED` | Commit 前に中止が確定 | 候補由来の変更なし |\n| `IN_DOUBT` | 障害により確定結果を判定できない | 新規確定を停止し照合 |\n| `RECOVERY_REQUIRED` | 回復手順が必要 | 回復完了まで確定扱い禁止 |\n\n`IN_DOUBT` は失敗確定を意味しません。また、`COMMITTING` は Commit 成功を意味しません。\n\n## **2\\. Commit の確定点**\n\n規範候補として、次の順序を定義します。\n\nPROPOSAL\n\n  \\-\\> VALIDATE\n\n  \\-\\> PREPARE\n\n  \\-\\> APPEND\\_CANONICAL\\_EVENT\n\n  \\-\\> DURABILITY\\_CONFIRMATION\n\n  \\-\\> COMMIT\\_CONFIRMED\n\n  \\-\\> ACKNOWLEDGE\\_CALLER\n\n  \\-\\> UPDATE\\_DERIVED\\_PROJECTIONS\n\n各段階の契約：\n\n1. `VALIDATE`：入力、権限、規範条件を決定論的に検証する。  \n2. `PREPARE`：`txid`、イベント内容、対象バージョン、期待する前提条件を固定する。  \n3. `APPEND_CANONICAL_EVENT`：Canonical History へイベントを追記する。  \n4. `DURABILITY_CONFIRMATION`：ストレージ契約に従い、追記の耐久性を確認する。  \n5. `COMMIT_CONFIRMED`：規定された確定条件が満たされた場合のみ成功を確定する。  \n6. `ACKNOWLEDGE_CALLER`：確定結果を呼出元へ通知する。  \n7. `UPDATE_DERIVED_PROJECTIONS`：派生状態を更新する。失敗しても、確定済み履歴を取り消さない。\n\n設計上の注意： `COMMIT_CONFIRMED` は、独立した永続レコードであるとは限りません。Canonical History 内のイベント自体が Commit を表す設計も可能です。別の Commit レコードを追加する場合は、イベントと Commit レコードの不整合をどう検出・回復するかを定義する必要があります。\n\n## **3\\. 障害発生位置と回復規則**\n\n| 障害位置 | 判定 | 必須動作 |\n| ----- | ----- | ----- |\n| 検証前・検証中 | 未確定 | Commit しない |\n| Prepare 前 | 未確定 | 再検証から開始 |\n| Prepare 後・追記前 | 未確定 | 永続記録を照合し、中止可能性を判定 |\n| 追記中 | `IN_DOUBT` 候補 | WAL の完全性を検証 |\n| 追記後・耐久性確認前 | `IN_DOUBT` | 成功扱いせず、永続状態を照合 |\n| 耐久性確認後・応答前 | Commit 済みの可能性 | 同一 `txid` を照合し、二重追記せず応答を再構成 |\n| Projection 更新中 | Commit 状態とは独立 | 履歴から Projection を再構築 |\n| 回復処理中 | `RECOVERY_REQUIRED` | 正規状態の変更を回復規則で制御 |\n\n障害後にメモリ上の状態が失われても、永続記録から確定結果を再構成できることが必要です。\n\nただし、追記後の耐久性確認前に障害が発生した場合、再起動後にイベントが存在する可能性も、存在しない可能性もあります。イベントの有無、完全性、耐久性を検証するまでは、結果を推測してはいけません。\n\n## **4\\. WAL と耐久性契約**\n\nWAL を唯一の真実とするには、少なくとも次の条件を明示する必要があります。\n\n* イベントのフレーミングと完全性検査  \n* イベント ID と `txid` の一意性  \n* レコードの完全性を判定する仕組み  \n* 部分書込み・末尾切断の検出規則  \n* 永続化完了を判定するストレージ契約  \n* 再起動後の走査順序と回復規則  \n* 破損した記録を暗黙に修正しない規則\n\nWAL の末尾が不完全な場合、その領域を自動的に正常イベントへ補完してはいけません。回復処理は、不完全レコードを識別し、確定済みイベントと区別し、必要な監査情報を保持します。\n\nまた、OS の書込み成功、ユーザー空間バッファのフラッシュ、ストレージの耐久性保証は同義ではありません。どこまでを Commit 成功の条件とするかは、実際のストレージ実装と同期方式に対応付ける必要があります。\n\n## **5\\. 冪等性と重複 Commit の排除**\n\n各 Commit 要求には、一意な `txid` を割り当てます。\n\n{\n\n  \"txid\": \"TX-EXAMPLE-001\",\n\n  \"proposal\\_id\": \"PROP-EXAMPLE-001\",\n\n  \"payload\\_digest\": \"DIGEST-PLACEHOLDER\",\n\n  \"expected\\_history\\_version\": \"HIST-VERSION-10\",\n\n  \"transaction\\_state\": \"PREPARED\"\n\n}\n\nこれは形式例であり、ダイジェスト値は実際の計算結果ではありません。\n\n### **同一 `txid` の再送**\n\n| 条件 | 動作 |\n| ----- | ----- |\n| `txid` とペイロードが一致し、Commit 済み | 既存結果を返す。再追記しない |\n| `txid` とペイロードが一致し、未確定 | 永続記録を照合して回復 |\n| `txid` が既存でペイロードが異なる | 拒否し、ID 衝突として記録 |\n| `txid` が存在しない | 通常の検証・Prepare 手順へ進む |\n| 同時に同一 `txid` の要求が到着 | 直列化または排他制御により一意に処理 |\n\nペイロードの比較は、単なる表示文字列比較ではなく、明示された正規化・シリアライズ契約に基づく必要があります。\n\n`txid` の一意性だけでは、異なる `txid` を持つ意味的に重複した提案を排除できません。業務上の重複判定が必要な場合は、別途一意性制約を定義します。\n\n## **6\\. Commit 結果不明時の照合手順**\n\n`IN_DOUBT` では、次の順序を候補規則とします。\n\n1. 該当 `txid` の永続記録を検索する。  \n2. 対象イベントの完全性と識別子を検証する。  \n3. Canonical History の確定済み位置・バージョンを確認する。  \n4. Commit の耐久性条件が満たされているか判定する。  \n5. 一意に確定できる場合のみ `COMMITTED`、`ABORTED` 等へ遷移する。  \n6. 結果を確定できなければ `IN_DOUBT` を維持し、再追記・成功応答を保留する。\n\nif verified\\_durable\\_commit\\_exists(txid):\n\n    COMMITTED\n\nelse if verified\\_abort\\_exists(txid):\n\n    ABORTED\n\nelse if absence\\_is\\_proven\\_under\\_storage\\_contract:\n\n    retry\\_or\\_abort\\_under\\_explicit\\_policy\n\nelse:\n\n    IN\\_DOUBT\n\nここで重要なのは、記録が見つからないことと、Commit が存在しないことを同一視しないことです。不存在を確定できる条件は、WAL の完全性・走査範囲・耐久性モデルに依存します。\n\n## **7\\. 受入試験候補**\n\n| TEST\\_ID | 試験条件 | 期待結果 |\n| ----- | ----- | ----- |\n| TXN-T-01 | 検証失敗後に Commit を要求 | Commit されない |\n| TXN-T-02 | WAL 追記中に障害注入 | 確定条件を満たすまで成功扱いしない |\n| TXN-T-03 | Commit 確定後・応答前に障害 | 再起動後に同一結果を復元 |\n| TXN-T-04 | 同一 `txid`・同一ペイロードを再送 | 二重追記しない |\n| TXN-T-05 | 同一 `txid`・異なるペイロード | 拒否 |\n| TXN-T-06 | WAL 末尾の部分レコード | 不完全記録として検出 |\n| TXN-T-07 | Commit 結果不明で再試行 | 照合前に再追記しない |\n| TXN-T-08 | Projection 更新に失敗 | Canonical History を変更せず復旧 |\n| TXN-T-09 | 永続化確認前にプロセス停止 | 成功と推測せず照合 |\n| TXN-T-10 | 同時 Commit 要求 | 定義済みの直列化規則に従う |\n\nこれらは設計上の試験候補であり、実行済みの結果ではありません。\n\n## **8\\. Step 23 判定**\n\nSTEP 23\n\nTRANSACTION CONTRACT DRAFTED\n\n定義済み：Commit 状態、確定点の候補、障害位置別の回復方針、WAL の要求事項、`txid` による冪等性、結果不明時の照合手順。\n\n未確定：実際の WAL 形式、ストレージ耐久性条件、Prepare／Commit の永続化方式、部分書込みからの回復規則、同時要求の直列化方式。\n\n実ファイル照合・編集・テスト・Freeze は未実施。EXECUTION\\_GATE \\= GATED。\n\n## **次段階：Step 24 — WAL レコード形式・回復アルゴリズム・整合性証明**\n\n次は、Step 23 の契約を実装に依存しないレベルで具体化します。\n\n1. WAL レコードの必須フィールドと識別子  \n2. レコードの完全性・順序・重複検証  \n3. 起動時の走査・分類・回復状態遷移  \n4. `IN_DOUBT` からの確定・中止条件  \n5. 履歴の破損・欠落・競合時の停止規則  \n6. 回復処理の冪等性と再実行可能性\n\nこれにより、通常時の Commit 契約とクラッシュ後の復旧契約を、同じ正規履歴モデルに接続します。\n\n",
  "semantic_kind": "Requirement",
  "semantic_evidence": {
    "phrases": [
      "Commit 成功を確定しない",
      "永続記録から確定結果を再構成できることが必要です",
      "WAL の末尾が不完全な場合、その領域を自動的に正常イベントへ補完してはいけません",
      "各 Commit 要求には、一意な `txid` を割り当てます",
      "WAL を唯一の真実とするには、少なくとも次の条件を明示する必要があります"
    ],
    "lines": [
      3687,
      3748,
      3754,
      3764,
      3770
    ]
  },
  "semantic_attributes": {
    "modality": "required",
    "structural_form": "other",
    "semantic_strength": "strong",
    "semantic_scope": "system-wide"
  },
  "resolution": {
    "status": "resolved",
    "reason": null
  }
}
