{
  "unit_id": "mdsu0038",
  "line_start": 6674,
  "line_end": 6992,
  "source_text": "# **Step 35 — Observability / Audit Logging / Operational Telemetry Contract**\n\nPROJECT \\= Chron-LLM\n\nSTEP \\= 35\n\nSTATUS \\= DESIGN\\_DRAFT\n\nEXECUTION\\_GATE \\= GATED\n\nCODE\\_CHANGE \\= PROHIBITED\n\nTEST\\_EXECUTION \\= NOT\\_PERFORMED\n\nFREEZE \\= NOT\\_AUTHORIZED\n\n## **35.1 目的**\n\nKernel の Commit、Validation、Authorization、Recovery、Replay、Projection 更新を観測可能にし、運用上の障害を検出・診断できるようにする。\n\n同時に、Telemetry・Operational Log・Audit Evidence を Canonical History と混同せず、監視基盤の障害が Commit の正当性や確定状態を変更しないことを規定する。\n\n基本原則：\n\nCANONICAL\\_HISTORY \\= SOURCE\\_OF\\_TRUTH\n\nAUDIT\\_EVIDENCE \\= ACCOUNTABILITY\n\nOPERATIONAL\\_LOG \\= DIAGNOSTICS\n\nTELEMETRY \\= OBSERVABILITY\n\nMETRICS \\= AGGREGATED\\_MEASUREMENTS\n\nTELEMETRY\\_FAILURE \\!= COMMIT\\_FAILURE\n\nTELEMETRY\\_SUCCESS \\!= COMMIT\\_SUCCESS\n\nAUDIT\\_LOG \\!= CANONICAL\\_HISTORY\n\n## **35.2 観測データの分類**\n\n| データ種別 | 目的 | Canonical 権限 |\n| ----- | ----- | ----- |\n| `CANONICAL_EVENT` | 確定済みの状態変更・規範イベント | Canonical Truth |\n| `AUDIT_RECORD` | 操作主体・認可・監査対象・結果の証跡 | 独立した証拠契約に従う |\n| `OPERATIONAL_LOG` | エラー、例外、内部処理の診断 | なし |\n| `METRIC` | 遅延、成功率、キュー長等の集計 | なし |\n| `TRACE` | 要求の処理経路・依存関係の追跡 | なし |\n| `ALERT` | 運用上の閾値・障害通知 | なし |\n| `HEALTH_STATUS` | コンポーネントの稼働状態 | なし |\n\nAudit Record が監査上の正式な証拠として使われる場合、その完全性・保持・アクセス制御・改ざん検知は独立した規範で定義する。単にログへ出力しただけでは、監査証拠として十分とは限らない。\n\n## **35.3 Event Correlation Contract**\n\n観測データ間の相関には、既存の識別子を目的別に使用する。\n\n候補フィールド：\n\n{\n\n  \"telemetry\\_schema\\_version\": \"UNSET\",\n\n  \"record\\_id\": \"UNSET\",\n\n  \"timestamp\": \"UNSET\",\n\n  \"request\\_id\": \"UNSET\",\n\n  \"correlation\\_id\": \"UNSET\",\n\n  \"causation\\_id\": \"UNSET\",\n\n  \"txid\": \"UNSET\",\n\n  \"event\\_id\": \"UNSET\",\n\n  \"component\\_id\": \"UNSET\",\n\n  \"operation\": \"UNSET\",\n\n  \"outcome\": \"UNSET\",\n\n  \"error\\_code\": \"UNSET\",\n\n  \"normative\\_version\": \"UNSET\"\n\n}\n\nこれは Schema 候補であり、採用済み定義ではない。\n\n規範候補：\n\n* `request_id`：要求の追跡。  \n* `correlation_id`：関連する複数処理の追跡。  \n* `causation_id`：因果関係を示す参照。  \n* `txid`：トランザクションの識別。  \n* `event_id`：Canonical Event の識別。  \n* `record_id`：観測レコード自体の識別。\n\nこれらの ID は相互に代用しない。Telemetry 上の因果関係を、Canonical History 上の因果関係として自動採用してはならない。\n\n## **35.4 Commit Lifecycle Observability**\n\nKernel の Commit 処理では、少なくとも次の状態遷移を観測可能にする。\n\nREQUEST\\_RECEIVED\n\n  \\-\\> VALIDATING\n\n  \\-\\> VALIDATED | VALIDATION\\_FAILED\n\n  \\-\\> AUTHORIZING\n\n  \\-\\> AUTHORIZED | DENIED | INDETERMINATE\n\n  \\-\\> PREPARING\n\n  \\-\\> APPENDING\n\n  \\-\\> DURABILITY\\_CHECK\n\n  \\-\\> COMMITTED | IN\\_DOUBT | ABORTED\n\n  \\-\\> PROJECTION\\_UPDATE\n\n  \\-\\> COMPLETE | PROJECTION\\_FAILED\n\nこれは観測対象となる状態の候補であり、Step 28〜31 で定義した規範的状態遷移を置き換えるものではない。\n\n重要な区別：\n\n* `COMMITTED` は Commit Contract に基づく判定であり、ログ出力の成功から推定しない。  \n* `IN_DOUBT` は通常の失敗カウンターに吸収せず、独立した状態として観測する。  \n* `PROJECTION_FAILED` は Canonical Commit の失敗と区別する。  \n* ログが欠落していることを、処理が実行されなかった証拠として扱わない。\n\n## **35.5 Audit Record Contract**\n\nAudit Record は、監査対象となる操作と、その判断根拠を追跡できる構造を持つ。\n\n候補フィールド：\n\n{\n\n  \"audit\\_schema\\_version\": \"UNSET\",\n\n  \"audit\\_record\\_id\": \"UNSET\",\n\n  \"action\": \"UNSET\",\n\n  \"principal\\_ref\": \"UNSET\",\n\n  \"target\\_ref\": \"UNSET\",\n\n  \"decision\": \"UNSET\",\n\n  \"policy\\_ref\": \"UNSET\",\n\n  \"evidence\\_refs\": \\[\\],\n\n  \"txid\": \"UNSET\",\n\n  \"event\\_id\": \"UNSET\",\n\n  \"result\": \"UNSET\",\n\n  \"integrity\\_metadata\": \"UNSET\"\n\n}\n\n規範候補：\n\n1. 認可判定、Commit 結果、Recovery 判断、保持・削除操作について、必要な監査対象を明示する。  \n2. `ALLOW`、`DENY`、`INDETERMINATE`、`POLICY_ERROR` を区別する。  \n3. Authorization の決定と Commit の実行結果を別フィールド・別イベントとして扱う。  \n4. 監査記録が生成されなかった場合、生成成功を偽装しない。  \n5. Audit Record を Canonical History に反映する必要がある場合は、明示的な Event Contract を経由する。ログ出力から Canonical Event を暗黙生成しない。  \n6. 監査記録の完全性・保存期間・削除権限は Step 33 の Retention Contract と整合させる。\n\n## **35.6 Telemetry Failure Policy**\n\nTelemetry の失敗を、Commit の成功・失敗とは独立して扱う。\n\n| 障害 | Canonical Commit への影響 | 処理方針候補 |\n| ----- | ----- | ----- |\n| Operational Log の書き込み失敗 | Commit 状態を変更しない | 障害を検出し、規定された代替診断経路を使用 |\n| Metrics Backend の停止 | Commit 状態を変更しない | Metrics を欠損扱いとし、成功値を捏造しない |\n| Trace の一部欠落 | Commit 状態を変更しない | 不完全な Trace として扱う |\n| Audit Record の書き込み失敗 | Commit を自動成功扱いしない | Audit Evidence が Commit の必須条件かどうかを明示的規範で判定 |\n| Telemetry Queue の飽和 | Commit 状態を変更しない | ドロップ・バックプレッシャー等の方式を規定する |\n| 監視アラート送信失敗 | Commit 状態を変更しない | アラート配信失敗を別途観測する |\n| Commit 結果ログの欠落 | Commit の有無を推定できない | Canonical History と Commit Evidence を照合 |\n| Audit と History の不一致 | 自動補正禁止 | 不整合を記録し、必要なら監査・Recovery を停止 |\n\n未確定の境界条件： 特定の Audit Evidence が Commit 前提条件となるシステムでは、その証拠の永続化を Commit Protocol にどう結び付けるかを別途定義する。Telemetry 一般の可用性要件から推定してはならない。\n\n## **35.7 Metrics Contract**\n\nメトリクスは運用状態の傾向を示すものであり、個々の Commit の正当性を証明するものではない。\n\n候補メトリクス：\n\n| Metric | 意味 |\n| ----- | ----- |\n| `commit_attempt_total` | Commit 要求試行数 |\n| `commit_confirmed_total` | 確定した Commit 数 |\n| `commit_in_doubt_total` | 未確定 Commit 数 |\n| `validation_failure_total` | Validation 失敗数 |\n| `authorization_denied_total` | Authorization 拒否数 |\n| `recovery_blocked_total` | Recovery 停止数 |\n| `replay_divergence_total` | Replay 不一致検出数 |\n| `projection_failure_total` | Projection 更新失敗数 |\n| `audit_write_failure_total` | Audit 記録失敗数 |\n| `telemetry_drop_total` | Telemetry 欠落数 |\n| `recovery_duration` | Recovery 処理時間 |\n| `commit_latency` | Commit 処理時間 |\n\nカウンターの定義、リセット条件、集計窓、重複排除、ラベル集合は未確定。\n\n特に、`commit_attempt_total` と `commit_confirmed_total` を同じ値として扱わない。また、`commit_in_doubt_total` は未確定要求の現在数なのか累積発生数なのかを明示する必要がある。\n\n高カーディナリティの `txid`、`event_id`、ユーザー識別子などを Metrics のラベルへ無条件に使用しない。個別調査には Logs・Audit・Trace の相関情報を使用する。\n\n## **35.8 Security / Privacy Contract**\n\n観測データは機密情報の複製経路になり得るため、出力内容とアクセス範囲を制御する。\n\n規範候補：\n\n* 秘密鍵、資格情報、認証トークンをログへ出力しない。  \n* Prompt、モデル出力、ユーザー提供文書を無条件に全文記録しない。  \n* 個人情報・機密仕様を記録する必要がある場合、目的・範囲・保持期間・アクセス権限を明示する。  \n* Redaction やマスキングを行う場合、元データの変更と監査記録の改変を混同しない。  \n* Digest だけで内容の秘匿性が得られると仮定しない。  \n* Audit Evidence の読み取り・エクスポート・削除も、適用ポリシーに応じて監査対象とする。\n\n## **35.9 Fault Injection Tests**\n\n以下はテスト設計候補であり、未実行。\n\n| Test ID | 条件 | 期待結果 |\n| ----- | ----- | ----- |\n| `OBS-T-01` | Commit 後に Operational Log を失敗させる | Canonical Commit を巻き戻さない |\n| `OBS-T-02` | Commit 結果ログを欠落させる | ログ欠落から Commit 結果を推定しない |\n| `OBS-T-03` | Metrics Backend を停止させる | Commit 状態を変更しない |\n| `OBS-T-04` | Trace の途中データを欠落させる | Trace を不完全として扱う |\n| `OBS-T-05` | Audit Record の永続化を失敗させる | 必須証拠の規範に従って処理する |\n| `OBS-T-06` | Authorization 成功後に Commit を拒否する | 認可成功と Commit 成功を区別 |\n| `OBS-T-07` | Projection 更新後に Telemetry を失敗させる | Canonical History を変更しない |\n| `OBS-T-08` | `IN_DOUBT` を通常失敗に集約する実装を検出 | 規範違反を検出 |\n| `OBS-T-09` | Secret を含む入力を診断ログへ送る | 秘密情報の出力を禁止・検出 |\n| `OBS-T-10` | Audit Record と Canonical History を不一致にする | 自動補正せず不整合を検出 |\n| `OBS-T-11` | 同一要求の再試行で Telemetry を重複生成 | Commit 数と観測レコード数を混同しない |\n| `OBS-T-12` | Telemetry Queue を飽和させる | 欠落・抑制・バックプレッシャーの挙動を規範どおりに扱う |\n\n## **35.10 Invariants**\n\nOBS-INV-01: TELEMETRY\\_IS\\_NOT\\_CANONICAL\\_AUTHORITY\n\nOBS-INV-02: TELEMETRY\\_SUCCESS \\!= COMMIT\\_SUCCESS\n\nOBS-INV-03: TELEMETRY\\_FAILURE \\!= COMMIT\\_FAILURE\n\nOBS-INV-04: LOG\\_ABSENCE \\!= PROOF\\_OF\\_OPERATION\\_ABSENCE\n\nOBS-INV-05: AUTHORIZATION\\_RESULT \\!= COMMIT\\_RESULT\n\nOBS-INV-06: IN\\_DOUBT\\_MUST\\_REMAIN\\_EXPLICIT\n\nOBS-INV-07: PROJECTION\\_FAILURE \\!= CANONICAL\\_COMMIT\\_FAILURE\n\nOBS-INV-08: AUDIT\\_EVIDENCE\\_REQUIRES\\_EXPLICIT\\_INTEGRITY\\_CONTRACT\n\nOBS-INV-09: METRICS\\_MUST\\_NOT\\_ASSERT\\_UNVERIFIED\\_COMMIT\\_SUCCESS\n\nOBS-INV-10: SECRET\\_MATERIAL\\_MUST\\_NOT\\_BE\\_EXPOSED\\_BY\\_DEFAULT\n\nOBS-INV-11: TELEMETRY\\_CORRELATION \\!= CANONICAL\\_CAUSATION\n\nOBS-INV-12: OBSERVABILITY\\_FAILURE\\_MUST\\_NOT\\_SILENTLY\\_CHANGE\\_COMMIT\\_SEMANTICS\n\n## **35.11 未確定事項**\n\n1. Audit Evidence の永続化が Commit の必須条件となる範囲。  \n2. Audit・Operational Log・Telemetry の保存先、耐久性、保持期間。  \n3. 観測データの改ざん検知と信頼の起点。  \n4. Telemetry Queue の飽和時における欠落・バックプレッシャー方針。  \n5. メトリクスの厳密な集計定義と重複排除規則。  \n6. Prompt・モデル出力・仕様本文の記録方針。  \n7. Audit Record と Canonical Event の関係。  \n8. アラートの重大度、閾値、通知失敗時の規範。  \n9. Step 33 の Retention Policy、Step 34 の DR Contract との整合性。\n\n## **Step 35 判定**\n\nDESIGN\\_DRAFT \\= COMPLETE\n\nOBSERVABILITY\\_CONTRACT \\= PROVISIONAL\n\nAUDIT\\_EVIDENCE\\_CONTRACT \\= UNRESOLVED\n\nTELEMETRY\\_DURABILITY \\= UNRESOLVED\n\nRETENTION\\_INTEGRATION \\= UNRESOLVED\n\nFAULT\\_TESTS \\= SPECIFIED\\_NOT\\_EXECUTED\n\nCODE\\_CHANGE \\= NOT\\_PERFORMED\n\nFREEZE \\= NOT\\_AUTHORIZED\n\nEXECUTION\\_GATE \\= GATED\n\n次段階：Step 36 — Health / Liveness / Readiness / Safe Degradation Contract\n\n目的は、Kernel・Storage・Replay・Policy・LLM Backend・Projection の稼働状態を区別し、ヘルスチェックの成功が Commit 能力や安全性を過大に示さないよう、サービス受け入れ・縮退運転・停止条件を定義することです。Step 31〜35 の未確定事項は引き継ぎ、未確定の耐久性・認可・監査要件を暗黙に確定しません。\n\n",
  "semantic_kind": "Requirement",
  "semantic_evidence": {
    "phrases": [
      "Step 35 — Observability / Audit Logging / Operational Telemetry Contract",
      "Telemetry の失敗を、Commit の成功・失敗とは独立して扱う。",
      "観測データは機密情報の複製経路になり得るため、出力内容とアクセス範囲を制御する。",
      "Audit Record は、監査対象となる操作と、その判断根拠を追跡できる構造を持つ。"
    ],
    "lines": [
      6674,
      6992
    ]
  },
  "semantic_attributes": {
    "modality": "must",
    "structural_form": "other",
    "semantic_strength": "strong",
    "semantic_scope": "system-wide"
  },
  "resolution": {
    "status": "resolved",
    "reason": null
  }
}
