{
  "unit_id": "mdsu0031",
  "line_start": 4775,
  "line_end": 5064,
  "source_text": "# **Step 28 — Commit Authority / Authorization Policy Formalization**\n\nMODE \\= DESIGN-ONLY EXECUTION\\_GATE \\= GATED STATUS \\= CONTRACT DRAFT\n\nOBJECTIVE:\n\n`PROPOSAL → VALIDATION → AUTHORIZATION → COMMIT DECISION → DURABLE HISTORY`\n\n中心原則：Commit 権限は Kernel に限定し、LLM・Validator・Projection・Replay に暗黙の Commit 権限を与えない。\n\n## **28.1 Authority Model**\n\n権限主体と責務を分離する。\n\n| Principal | 許可する責務 | 禁止事項 |\n| ----- | ----- | ----- |\n| `LLM_PROPOSER` | 提案の生成 | Canonical History の変更・認可 |\n| `VALIDATOR` | 契約・参照・不変条件の検証 | 検証結果を Commit として確定 |\n| `POLICY_ENGINE` | 明示的な認可条件の評価 | 自ら履歴へ Commit |\n| `KERNEL_COMMITTER` | 認可済み操作の Commit | 契約外の操作・暗黙の権限昇格 |\n| `REPLAY_ENGINE` | 履歴から状態を再構築 | 履歴の変更・イベントの再 Commit |\n| `PROJECTION_BUILDER` | 派生状態の構築 | Projection から History への逆書込み |\n| `AUDIT_WRITER` | 監査証跡の記録 | 監査権限を利用した業務状態変更 |\n\n`POLICY_ENGINE` と `KERNEL_COMMITTER` は論理的な責務区分であり、必ずしも独立プロセスである必要はない。認可判定の最終的な強制点は Kernel 内に置く。\n\n## **28.2 Authorization Contract**\n\n認可判定の入力候補：\n\n{\n\n  \"authorization\\_request\\_id\": \"AUTH-000001\",\n\n  \"principal\\_id\": \"KERNEL\\_COMMITTER\",\n\n  \"action\": \"COMMIT\\_EVENT\",\n\n  \"resource\": \"CANONICAL\\_HISTORY\",\n\n  \"proposal\\_id\": \"PROP-000001\",\n\n  \"payload\\_digest\": \"DIGEST-PLACEHOLDER\",\n\n  \"policy\\_version\": \"POLICY-0.1\",\n\n  \"execution\\_gate\": \"GATED\"\n\n}\n\nこれはスキーマ案であり、実際の認可記録ではない。\n\n認可判定は、少なくとも次を評価する。\n\n* 主体が登録済みである。  \n* 要求された操作が主体に許可されている。  \n* 対象リソースとイベント型が認可範囲内である。  \n* 提案・ペイロードの識別子が検証対象と一致する。  \n* 必要な証拠と事前検証が完了している。  \n* 適用されるポリシーバージョンが特定できる。  \n* 実行ゲートが当該操作を許可している。  \n* 認可が Commit 時点で有効である。\n\n重要： 認可判定が `ALLOW` でも、Commit が成功したことにはならない。\n\n## **28.3 Authorization Result**\n\n認可結果候補：\n\n| Result | 意味 | 処理 |\n| ----- | ----- | ----- |\n| `ALLOW` | 全認可条件を満たす | Commit 処理への進行を許可 |\n| `DENY` | 認可条件への違反を確認 | Commit を禁止 |\n| `INDETERMINATE` | 判定に必要な情報が不足 | Commit を保留 |\n| `POLICY_ERROR` | ポリシー評価自体が失敗 | Commit を禁止 |\n\n認可エラーを `ALLOW` に変換するフォールバックは禁止する。\n\nまた、`DENY` と `INDETERMINATE` は異なる。前者は拒否根拠が確定した状態、後者は判断に必要な条件が満たされていない状態である。\n\n## **28.4 Commit State Machine**\n\nPROPOSED\n\n   |\n\n   v\n\nVALIDATING\n\n   |---- validation failure \\----\\> REJECTED / VALIDATION\\_FAILED\n\n   v\n\nVALIDATED\n\n   |\n\n   v\n\nAUTHORIZING\n\n   |---- DENY \\------------------\\> DENIED\n\n   |---- INDETERMINATE \\---------\\> ON\\_HOLD\n\n   |---- POLICY\\_ERROR \\----------\\> AUTHORIZATION\\_FAILED\n\n   v\n\nAUTHORIZED\n\n   |\n\n   v\n\nPREPARED\n\n   |\n\n   v\n\nDURABLE\\_COMMIT\n\n   |---- outcome uncertain \\-----\\> IN\\_DOUBT\n\n   v\n\nCOMMITTED\n\n   |\n\n   v\n\nPROJECTION\\_UPDATE\n\n   |---- failure \\---------------\\> COMMITTED / PROJECTION\\_FAILED\n\n   v\n\nCOMPLETE\n\nこの状態機械は候補であり、Step 23 のトランザクション状態と統合する際に遷移の重複を解消する必要がある。\n\n規範候補：\n\n1. `VALIDATED → AUTHORIZED` は明示的な認可判定を必要とする。  \n2. `AUTHORIZED → COMMITTED` は耐久性契約を満たす Commit 処理を必要とする。  \n3. 認可対象のペイロードが変わった場合、以前の認可をそのまま再利用しない。  \n4. `IN_DOUBT` は成功・失敗のいずれにも自動変換しない。  \n5. Projection の更新失敗によって、既に確定した Commit を暗黙に取り消さない。  \n6. 認可・検証の失敗を成功状態へ遷移させない。\n\n## **28.5 GATED → AUTHORIZED の境界**\n\n`GATED` は認可結果ではなく、操作実行に関するゲート状態である。\n\nしたがって、次の区別を維持する。\n\nPOLICY\\_ALLOW       \\!= EXECUTION\\_GATE\\_AUTHORIZED\n\nEXECUTION\\_AUTHORIZED \\!= COMMIT\\_SUCCEEDED\n\nCOMMIT\\_SUCCEEDED   \\!= PROJECTION\\_SUCCEEDED\n\n`GATED` を解除する操作には、別途定義された認可権限と承認証跡を要求する。\n\n承認証跡の候補フィールド：\n\n* `approval_id`  \n* `approved_action`  \n* `approved_scope`  \n* `target_digest` または対象バージョン  \n* `approver_identity`  \n* `policy_version`  \n* `approval_evidence_ref`  \n* `issued_at`（時刻が必要な場合）  \n* `expiration` または失効条件（必要な場合）\n\n対象範囲を限定せず、単に「承認済み」というフラグだけでゲートを解除する方式は採用しない。\n\n## **28.6 Authorization Binding**\n\n認可と実行対象のすり替えを防ぐため、認可結果を対象へ結び付ける。\n\n候補となる束縛対象：\n\n$A=H(P\\parallel R\\parallel V\\parallel S)$\n\n* $P$：対象ペイロードの正規表現  \n* $R$：要求された操作とリソース  \n* $V$：ポリシー・規範バージョン  \n* $S$：対象範囲・実行スコープ\n\nこの式は概念モデルであり、実際のエンコード・ハッシュ方式は Step 27 の正規化契約に従う。\n\n認可後にペイロード、操作、対象範囲、適用ポリシーが変化した場合は、認可を再評価する。認可結果を別の対象へ転用しない。\n\n## **28.7 Failure Taxonomy**\n\nAUTH\\_PRINCIPAL\\_UNKNOWN\n\nAUTH\\_ACTION\\_NOT\\_PERMITTED\n\nAUTH\\_RESOURCE\\_OUT\\_OF\\_SCOPE\n\nAUTH\\_EVIDENCE\\_MISSING\n\nAUTH\\_TARGET\\_DIGEST\\_MISMATCH\n\nAUTH\\_POLICY\\_VERSION\\_UNKNOWN\n\nAUTH\\_POLICY\\_DENIED\n\nAUTH\\_POLICY\\_INDETERMINATE\n\nAUTH\\_POLICY\\_EVALUATION\\_FAILED\n\nAUTH\\_APPROVAL\\_INVALID\n\nAUTH\\_APPROVAL\\_EXPIRED\n\nAUTH\\_APPROVAL\\_SCOPE\\_MISMATCH\n\nAUTH\\_REPLAY\\_DETECTED\n\nCOMMIT\\_WITHOUT\\_AUTHORIZATION\n\nEXECUTION\\_GATE\\_BYPASS\\_ATTEMPT\n\nこれらはエラーコード候補である。特に `AUTH_REPLAY_DETECTED` の判定には、承認識別子の一意性、再利用条件、保持期間を定義する必要がある。\n\n## **28.8 Invariants**\n\n* AUTH-INV-01: LLM 出力は認可証拠にならない。  \n* AUTH-INV-02: Validator の成功は Commit 権限を付与しない。  \n* AUTH-INV-03: `GATED` の操作は、有効な明示的認可なしに実行できない。  \n* AUTH-INV-04: 認可対象と実行対象の識別情報は一致しなければならない。  \n* AUTH-INV-05: `DENY`、`INDETERMINATE`、`POLICY_ERROR` は Commit 成功へ変換されない。  \n* AUTH-INV-06: Commit 成功の判定は耐久性契約に従う。  \n* AUTH-INV-07: 拒否された提案は Canonical State を変更しない。  \n* AUTH-INV-08: Projection・Replay は Canonical History の変更権限を持たない。  \n* AUTH-INV-09: 認可証跡の欠落・矛盾は成功扱いされない。  \n* AUTH-INV-10: ポリシーバージョンを特定できない場合、認可成功を推測しない。\n\n監査証跡自体を追加する場合、その書込みと業務状態の変更は区別する。\n\n## **28.9 Acceptance Tests**\n\n| Test ID | ケース | 期待結果 |\n| ----- | ----- | ----- |\n| AUTH-T-01 | LLM が Commit を要求 | Kernel の認可契約を通過しない限り拒否 |\n| AUTH-T-02 | Validator 成功・認可なし | Commit 不許可 |\n| AUTH-T-03 | `GATED` のまま実行要求 | 拒否 |\n| AUTH-T-04 | 認可後にペイロードを変更 | 認可を無効化し再評価 |\n| AUTH-T-05 | 対象外リソースへの認可転用 | 拒否 |\n| AUTH-T-06 | ポリシー評価器の障害 | Commit 不許可 |\n| AUTH-T-07 | Commit 結果が不明 | `IN_DOUBT` として回復処理へ |\n| AUTH-T-08 | Projection 更新失敗 | Canonical Commit を維持 |\n| AUTH-T-09 | 拒否後の状態を再構築 | 拒否対象による状態変更なし |\n| AUTH-T-10 | 古い承認証跡の再利用 | 定義済みの有効性・再利用規則に従って判定 |\n\n試験設計のみ。実行・合格判定は未実施。\n\n## **28.10 Step 28 判定**\n\nSTEP 28\n\nCONTRACT DRAFTED\n\n定義候補：主体別権限、認可結果、Commit 状態遷移、GATED 境界、対象への認可束縛、不変条件、受入試験。\n\n未解決：実際の主体・権限モデル、承認者の信頼根拠、ポリシー失効・再評価規則、トランザクション状態機械との統合、監査証跡の永続化契約。\n\n設計案のみ。ファイル変更・テスト実行・正式採用・Freeze は未実施。EXECUTION\\_GATE \\= GATED。\n\n## **Step 29 — Policy Versioning / Revocation / Time-of-Check-to-Time-of-Use**\n\n次段階では、認可時点と Commit 時点の間に生じる変更を扱う。\n\n1. 認可対象ポリシーの固定とバージョン識別  \n2. 認可後のポリシー変更・失効の意味論  \n3. 認可判定から Commit までの TOCTOU 対策  \n4. 認可証跡とトランザクション ID の束縛  \n5. 失効・期限切れ・競合する承認の優先規則  \n6. 再試行・回復時の認可再検証  \n7. Replay で過去の認可をどう検証するか\n\n中心課題： 認可時に正当だった操作が、Commit 時点でも正当であることをどう保証するか。過去の確定イベントの再生と、新しい操作に対する現在の認可判定も混同しない。\n\n",
  "semantic_kind": "Requirement",
  "semantic_evidence": {
    "phrases": [
      "Commit 権限は Kernel に限定し、LLM・Validator・Projection・Replay に暗黙の Commit 権限を与えない。",
      "認可エラーを `ALLOW` に変換するフォールバックは禁止する。",
      "`GATED` を解除する操作には、別途定義された認可権限と承認証跡を要求する。",
      "`GATED` の操作は、有効な明示的認可なしに実行できない。",
      "認可対象と実行対象の識別情報は一致しなければならない。",
      "認可後にペイロード、操作、対象範囲、適用ポリシーが変化した場合は、認可を再評価する。認可結果を別の対象へ転用しない。"
    ],
    "lines": [
      4783,
      4851,
      4940,
      5011,
      5012,
      4971
    ]
  },
  "semantic_attributes": {
    "modality": "prohibited",
    "structural_form": "other",
    "semantic_strength": "strong",
    "semantic_scope": "system-wide"
  },
  "resolution": {
    "status": "resolved",
    "reason": null
  }
}
